{"schema":"casegraphen.experimental.control_plane.response.v0","sequence":1,"request_id":"request:runtime-attachment-1","idempotency_key":"runtime-attachment:1:revision-1","replayed":false,"authority_facts":{"caller_declared_audit_context_present":true,"canonical_casegraphen_authorization":"not_evaluated"},"result":null,"refusal":{"code":"stale_revision","detail":"client-observed base revision is not current","supplied_base_revision_id":"revision:1","current_revision_id":"revision:2","suggested_next_operation":"re_read_state_and_resubmit_explicitly"}}
