{"schema":"casegraphen.experimental.control_plane.response.v0","sequence":2,"request_id":"request:evaluate-expansion-round-1","idempotency_key":"evaluate-expansion-round:1:revision-2","replayed":false,"authority_facts":{"caller_declared_audit_context_present":true,"canonical_casegraphen_authorization":"not_evaluated"},"result":{"base_revision_id":"revision:2","rounds":[],"accepted":false,"review_status":"unreviewed"},"refusal":null}
